{
  "snapshot_id": "tcs-068a0d6d496b1ef8",
  "resolved": [
    {
      "id": "vercy.plmm",
      "version": "0.2.0",
      "semantic_fingerprint": "mufp:c31d75e8a92b40f6",
      "source_ref": "v0.2.0"
    },
    {
      "id": "vercy.aismm",
      "version": "3.1.0",
      "semantic_fingerprint": "mufp:9f2c47d1a83e50b6",
      "source_ref": "v3.1.0"
    },
    {
      "id": "vercy.apmm",
      "version": "0.1.0",
      "semantic_fingerprint": "mufp:4b8e21c9d05f7a36",
      "source_ref": "v0.1.0"
    },
    {
      "id": "vercy.oumm",
      "version": "0.1.0",
      "semantic_fingerprint": "mufp:b7f4e2a10c93d856",
      "source_ref": ""
    },
    {
      "id": "vercy.collective",
      "version": "0.2.0",
      "semantic_fingerprint": "mufp:cb346c3d019a37ef",
      "source_ref": "v0.2.0"
    }
  ],
  "edges_hash": "sha256:59d5024adfe500ca312bdeaab2b16f3db901e9cebbe2ad935ffd80aa626775ef",
  "created_at": "2026-08-09T10:15:00Z",
  "task_ref": "task-product-impact-0001"
}
